{
  "id": "king_expand_iron_gate_011",
  "name": "Iron Gate",
  "owner_type": "king",
  "category": "protection",
  "rarity": "common",
  "copies_in_deck": 1,
  "timing": "reactive",
  "effect": {
    "primitive": "protect_gold",
    "params": {
      "target": "self",
      "amount": 80,
      "duration_rounds": 1,
      "specificity": "generic",
      "trigger": {
        "type": "attacked_this_phase",
        "target": "self",
        "attack_type": "gold_theft"
      }
    }
  },
  "tags": [
    "protection"
  ],
  "flavor_text": "Expansion design \u2014 Iron Gate.",
  "designer_notes": "Phase 5a deck expansion for subset sweeps.",
  "on_whiff_penalty": {
    "primitive": "gold_loss",
    "params": {
      "target": "self",
      "amount": 25
    }
  }
}