{
  "id": "king_expand_imperial_mandate_015",
  "name": "Imperial Mandate",
  "owner_type": "king",
  "category": "supercard",
  "rarity": "supercard",
  "copies_in_deck": 1,
  "timing": "on_reveal",
  "effect": {
    "primitive": "dice_swing",
    "params": {
      "choices": [
        { "id": "brand", "label": "Brand a Rival" },
        { "id": "squeeze", "label": "Squeeze the Court" }
      ],
      "branches": {
        "brand": {
          "on_success": {
            "primitive": "gold_gain",
            "params": { "target": "self", "amount": 50 },
            "secondary_effect": {
              "primitive": "mark_status",
              "params": {
                "target": "target",
                "status_name": "marked",
                "duration_rounds": 2
              }
            }
          }
        },
        "squeeze": {
          "on_success": {
            "primitive": "gold_gain",
            "params": { "target": "self", "amount": 140 },
            "secondary_effect": {
              "primitive": "skip_next_play",
              "params": { "target": "self" }
            }
          }
        }
      }
    }
  },
  "tags": ["supercard"],
  "flavor_text": "Mark them for the warrant, or take the coin and sit out a card.",
  "designer_notes": "Brand marks the target so Sealed Warrant and similar cards hit harder. Squeeze pays more but you play one fewer card next round."
}
