{
  "id": "noble_expand_merchant_league_003",
  "name": "Merchant League",
  "owner_type": "noble",
  "category": "economy",
  "rarity": "common",
  "copies_in_deck": 1,
  "timing": "on_reveal",
  "effect": {
    "primitive": "gold_gain",
    "params": {
      "target": "self",
      "amount": 70
    }
  },
  "tags": [
    "economy"
  ],
  "flavor_text": "Expansion design \u2014 Merchant League.",
  "designer_notes": "Phase 5a deck expansion for subset sweeps."
}