{
  "id": "king_expand_haste_edict_012",
  "name": "Haste Edict",
  "owner_type": "king",
  "category": "tempo",
  "rarity": "common",
  "copies_in_deck": 1,
  "timing": "on_reveal",
  "effect": {
    "primitive": "extra_play",
    "params": {
      "target": "self",
      "count": 1
    }
  },
  "tags": [
    "tempo"
  ],
  "flavor_text": "Expansion design \u2014 Haste Edict.",
  "designer_notes": "Phase 5a deck expansion for subset sweeps."
}