{
  "id": "king_alliance_summit_001",
  "name": "Alliance Summit",
  "owner_type": "king",
  "category": "alliance",
  "rarity": "common",
  "copies_in_deck": 1,
  "timing": "on_reveal",
  "effect": {
    "primitive": "alliance_bonus",
    "params": {
      "players": [
        "self",
        "target"
      ],
      "amount": 41
    }
  },
  "requires_state": {
    "alliance_declared_with_target": true
  },
  "tags": [
    "alliance"
  ],
  "flavor_text": "The crown rewards loyalty \u2014 when it suits the crown."
}
